{"CaseDescription": "Kevin Johnson DOI 9/28/2023 Swift Transportation Phila PA Injury back damage CL was working driving an 18 wheeler and was hit and injured by another commercial truck. CL injured his back and had back surgery that was diagnosed as L4 L5 damage. CL lost time form work and loss of income. Still seeing doctors and taking pain meds. Damages CL uses cane and suffers from limited mobility", "PrimaryCaseType": "Workers Compensation", "SecondaryCaseType": "Automobile Accident", "CaseRating": "Tier 3", "CaseState": "PA Pennsylvania", "IsWorkersCompensation": "Yes", "Confidence(%)": "90%", "Explanation": "The description indicates that the client was driving an 18 wheeler for work when he was hit and injured by another commercial truck. This falls under the Workers Compensation primary case type. The fact that the injury was caused by an automobile accident makes the secondary case type Automobile Accident. The injury is described as L4 L5 damage, which requires surgery, putting it in Tier 4. The incident happened in Philadelphia, PA, so the case state is PA Pennsylvania. The description also specifies that the client was working at the time, so this is a Workers Compensation case. The confidence level is high due to the clear description of the incident and the identification of the state.\n\nThe case rating is Tier 3 and case types are Workers Compensation and Automobile Accident, which fall under the 'Any' category. Therefore, according to the handling rules for the state, the recommended handling firm is 'REFER TO PA SECTION'.", "HandlingFirm": "REFER TO PA SECTION"}
{"CaseDescription": "Kevin Johnson DOI 9/28/2023 Swift Transportation Phila PA Injury back damage CL was working driving an 18 wheeler and was hit and injured by another commercial truck. CL injured his back and had back surgery that was diagnosed as L4 L5 damage. CL lost time form work and loss of income. Still seeing doctors and taking pain meds. Damages CL uses cane and suffers from limited mobility", "PrimaryCaseType": "Workers Compensation", "SecondaryCaseType": "Automobile Accident", "CaseRating": "Tier 3", "CaseState": "PA Pennsylvania", "IsWorkersCompensation": "Yes", "Confidence(%)": "90%", "Explanation": "The description indicates that the client was driving an 18 wheeler for work when he was hit and injured by another commercial truck. This falls under the Workers Compensation primary case type. The fact that the injury was caused by an automobile accident makes the secondary case type Automobile Accident. The injury is described as L4 L5 damage, which requires surgery, putting it in Tier 4. The incident happened in Philadelphia, PA, so the case state is PA Pennsylvania. The description also specifies that the client was working at the time, so this is a Workers Compensation case. The confidence level is high due to the clear description of the incident and the identification of the state.\n\nThe case rating is Tier 3 and case types are Workers Compensation and Automobile Accident, which fall under the 'Any' category. Therefore, according to the handling rules for the state, the recommended handling firm is 'REFER TO PA SECTION'.", "HandlingFirm": "REFER TO PA SECTION"}
{"CaseDescription": "Kevin Johnson DOI 9/28/2023 Swift Transportation Phila PA Injury back damage CL was working driving an 18 wheeler and was hit and injured by another commercial truck. CL injured his back and had back surgery that was diagnosed as L4 L5 damage. CL lost time form work and loss of income. Still seeing doctors and taking pain meds. Damages CL uses cane and suffers from limited mobility", "PrimaryCaseType": "Workers Compensation", "SecondaryCaseType": "Automobile Accident", "CaseRating": "Tier 3", "CaseState": "PA Pennsylvania", "IsWorkersCompensation": "Yes", "Confidence(%)": "90%", "Explanation": "The description indicates that the client was driving an 18 wheeler for work when he was hit and injured by another commercial truck. This falls under the Workers Compensation primary case type. The fact that the injury was caused by an automobile accident makes the secondary case type Automobile Accident. The injury is described as L4 L5 damage, which requires surgery, putting it in Tier 4. The incident happened in Philadelphia, PA, so the case state is PA Pennsylvania. The description also specifies that the client was working at the time, so this is a Workers Compensation case. The confidence level is high due to the clear description of the incident and the identification of the state.\n\nThe case rating is Tier 3 and case types are Workers Compensation and Automobile Accident, which fall under the 'Any' category. Therefore, according to the handling rules for the state, the recommended handling firm is 'REFER TO PA SECTION'.", "HandlingFirm": "REFER TO PA SECTION"}
{"CaseDescription": "Kevin Johnson DOI 9/28/2023 Swift Transportation Phila PA Injury back damage CL was working driving an 18 wheeler and was hit and injured by another commercial truck. CL injured his back and had back surgery that was diagnosed as L4 L5 damage. CL lost time form work and loss of income. Still seeing doctors and taking pain meds. Damages CL uses cane and suffers from limited mobility", "PrimaryCaseType": "Workers Compensation", "SecondaryCaseType": "Automobile Accident", "CaseRating": "Tier 3", "CaseState": "PA Pennsylvania", "IsWorkersCompensation": "Yes", "Confidence(%)": "90%", "Explanation": "The description indicates that the client was driving an 18 wheeler for work when he was hit and injured by another commercial truck. This falls under the Workers Compensation primary case type. The fact that the injury was caused by an automobile accident makes the secondary case type Automobile Accident. The injury is described as L4 L5 damage, which requires surgery, putting it in Tier 4. The incident happened in Philadelphia, PA, so the case state is PA Pennsylvania. The description also specifies that the client was working at the time, so this is a Workers Compensation case. The confidence level is high due to the clear description of the incident and the identification of the state.\n\nThe case rating is Tier 3 and case types are Workers Compensation and Automobile Accident, which fall under the 'Any' category. Therefore, according to the handling rules for the state, the recommended handling firm is 'REFER TO PA SECTION'.", "HandlingFirm": "REFER TO PA SECTION"}
{"CaseDescription": "Kevin Johnson DOI 9/28/2023 Swift Transportation Phila PA Injury back damage CL was working driving an 18 wheeler and was hit and injured by another commercial truck. CL injured his back and had back surgery that was diagnosed as L4 L5 damage. CL lost time form work and loss of income. Still seeing doctors and taking pain meds. Damages CL uses cane and suffers from limited mobility", "PrimaryCaseType": "Workers Compensation", "SecondaryCaseType": "Automobile Accident", "CaseRating": "Tier 3", "CaseState": "PA Pennsylvania", "IsWorkersCompensation": "Yes", "Confidence(%)": "90%", "Explanation": "The description indicates that the client was driving an 18 wheeler for work when he was hit and injured by another commercial truck. This falls under the Workers Compensation primary case type. The fact that the injury was caused by an automobile accident makes the secondary case type Automobile Accident. The injury is described as L4 L5 damage, which requires surgery, putting it in Tier 4. The incident happened in Philadelphia, PA, so the case state is PA Pennsylvania. The description also specifies that the client was working at the time, so this is a Workers Compensation case. The confidence level is high due to the clear description of the incident and the identification of the state.\n\nThe case rating is Tier 3 and case types are Workers Compensation and Automobile Accident, which fall under the 'Any' category. Therefore, according to the handling rules for the state, the recommended handling firm is 'REFER TO PA SECTION'.", "HandlingFirm": "REFER TO PA SECTION"}
{"CaseDescription": "Kevin Johnson DOI 9/28/2023 Swift Transportation Phila PA Injury back damage CL was working driving an 18 wheeler and was hit and injured by another commercial truck. CL injured his back and had back surgery that was diagnosed as L4 L5 damage. CL lost time form work and loss of income. Still seeing doctors and taking pain meds. Damages CL uses cane and suffers from limited mobility", "PrimaryCaseType": "Workers Compensation", "SecondaryCaseType": "Automobile Accident", "CaseRating": "Tier 3", "CaseState": "PA Pennsylvania", "IsWorkersCompensation": "Yes", "Confidence(%)": "90%", "Explanation": "The description indicates that the client was driving an 18 wheeler for work when he was hit and injured by another commercial truck. This falls under the Workers Compensation primary case type. The fact that the injury was caused by an automobile accident makes the secondary case type Automobile Accident. The injury is described as L4 L5 damage, which requires surgery, putting it in Tier 4. The incident happened in Philadelphia, PA, so the case state is PA Pennsylvania. The description also specifies that the client was working at the time, so this is a Workers Compensation case. The confidence level is high due to the clear description of the incident and the identification of the state.\n\nThe case rating is Tier 3 and case types are Workers Compensation and Automobile Accident, which fall under the 'Any' category. Therefore, according to the handling rules for the state, the recommended handling firm is 'REFER TO PA SECTION'.", "HandlingFirm": "REFER TO PA SECTION"}
{"CaseDescription": "Kevin Johnson DOI 9/28/2023 Swift Transportation Phila PA Injury back damage CL was working driving an 18 wheeler and was hit and injured by another commercial truck. CL injured his back and had back surgery that was diagnosed as L4 L5 damage. CL lost time form work and loss of income. Still seeing doctors and taking pain meds. Damages CL uses cane and suffers from limited mobility", "PrimaryCaseType": "Workers Compensation", "SecondaryCaseType": "Automobile Accident", "CaseRating": "Tier 3", "CaseState": "PA Pennsylvania", "IsWorkersCompensation": "Yes", "Confidence(%)": "90%", "Explanation": "The description indicates that the client was driving an 18 wheeler for work when he was hit and injured by another commercial truck. This falls under the Workers Compensation primary case type. The fact that the injury was caused by an automobile accident makes the secondary case type Automobile Accident. The injury is described as L4 L5 damage, which requires surgery, putting it in Tier 4. The incident happened in Philadelphia, PA, so the case state is PA Pennsylvania. The description also specifies that the client was working at the time, so this is a Workers Compensation case. The confidence level is high due to the clear description of the incident and the identification of the state.\n\nThe case rating is Tier 3 and case types are Workers Compensation and Automobile Accident, which fall under the 'Any' category. Therefore, according to the handling rules for the state, the recommended handling firm is 'REFER TO PA SECTION'.", "HandlingFirm": "REFER TO PA SECTION"}
{"CaseDescription": "Kevin Johnson DOI 9/28/2023 Swift Transportation Phila PA Injury back damage CL was working driving an 18 wheeler and was hit and injured by another commercial truck. CL injured his back and had back surgery that was diagnosed as L4 L5 damage. CL lost time form work and loss of income. Still seeing doctors and taking pain meds. Damages CL uses cane and suffers from limited mobility", "PrimaryCaseType": "Workers Compensation", "SecondaryCaseType": "Automobile Accident", "CaseRating": "Tier 3", "CaseState": "PA Pennsylvania", "IsWorkersCompensation": "Yes", "Confidence(%)": "90%", "Explanation": "The description indicates that the client was driving an 18 wheeler for work when he was hit and injured by another commercial truck. This falls under the Workers Compensation primary case type. The fact that the injury was caused by an automobile accident makes the secondary case type Automobile Accident. The injury is described as L4 L5 damage, which requires surgery, putting it in Tier 4. The incident happened in Philadelphia, PA, so the case state is PA Pennsylvania. The description also specifies that the client was working at the time, so this is a Workers Compensation case. The confidence level is high due to the clear description of the incident and the identification of the state.\n\nThe case rating is Tier 3 and case types are Workers Compensation and Automobile Accident, which fall under the 'Any' category. Therefore, according to the handling rules for the state, the recommended handling firm is 'REFER TO PA SECTION'.", "HandlingFirm": "REFER TO PA SECTION"}
{"CaseDescription": "Kevin Johnson DOI 9/28/2023 Swift Transportation Phila PA Injury back damage CL was working driving an 18 wheeler and was hit and injured by another commercial truck. CL injured his back and had back surgery that was diagnosed as L4 L5 damage. CL lost time form work and loss of income. Still seeing doctors and taking pain meds. Damages CL uses cane and suffers from limited mobility", "PrimaryCaseType": "Workers Compensation", "SecondaryCaseType": "Automobile Accident", "CaseRating": "Tier 3", "CaseState": "PA Pennsylvania", "IsWorkersCompensation": "Yes", "Confidence(%)": "90%", "Explanation": "The description indicates that the client was driving an 18 wheeler for work when he was hit and injured by another commercial truck. This falls under the Workers Compensation primary case type. The fact that the injury was caused by an automobile accident makes the secondary case type Automobile Accident. The injury is described as L4 L5 damage, which requires surgery, putting it in Tier 4. The incident happened in Philadelphia, PA, so the case state is PA Pennsylvania. The description also specifies that the client was working at the time, so this is a Workers Compensation case. The confidence level is high due to the clear description of the incident and the identification of the state.\n\nThe case rating is Tier 3 and case types are Workers Compensation and Automobile Accident, which fall under the 'Any' category. Therefore, according to the handling rules for the state, the recommended handling firm is 'REFER TO PA SECTION'.", "HandlingFirm": "REFER TO PA SECTION"}
{"CaseDescription": "Kevin Johnson DOI 9/28/2023 Swift Transportation Phila PA Injury back damage CL was working driving an 18 wheeler and was hit and injured by another commercial truck. CL injured his back and had back surgery that was diagnosed as L4 L5 damage. CL lost time form work and loss of income. Still seeing doctors and taking pain meds. Damages CL uses cane and suffers from limited mobility", "PrimaryCaseType": "Workers Compensation", "SecondaryCaseType": "Automobile Accident", "CaseRating": "Tier 3", "CaseState": "PA Pennsylvania", "IsWorkersCompensation": "Yes", "Confidence(%)": "90%", "Explanation": "The description indicates that the client was driving an 18 wheeler for work when he was hit and injured by another commercial truck. This falls under the Workers Compensation primary case type. The fact that the injury was caused by an automobile accident makes the secondary case type Automobile Accident. The injury is described as L4 L5 damage, which requires surgery, putting it in Tier 4. The incident happened in Philadelphia, PA, so the case state is PA Pennsylvania. The description also specifies that the client was working at the time, so this is a Workers Compensation case. The confidence level is high due to the clear description of the incident and the identification of the state.\n\nThe case rating is Tier 3 and case types are Workers Compensation and Automobile Accident, which fall under the 'Any' category. Therefore, according to the handling rules for the state, the recommended handling firm is 'REFER TO PA SECTION'.", "HandlingFirm": "REFER TO PA SECTION"}
{"CaseDescription": "Kevin Johnson DOI 9/28/2023 Swift Transportation Phila PA Injury back damage CL was working driving an 18 wheeler and was hit and injured by another commercial truck. CL injured his back and had back surgery that was diagnosed as L4 L5 damage. CL lost time form work and loss of income. Still seeing doctors and taking pain meds. Damages CL uses cane and suffers from limited mobility", "PrimaryCaseType": "Workers Compensation", "SecondaryCaseType": "Automobile Accident", "CaseRating": "Tier 3", "CaseState": "PA Pennsylvania", "IsWorkersCompensation": "Yes", "Confidence(%)": "90%", "Explanation": "The description indicates that the client was driving an 18 wheeler for work when he was hit and injured by another commercial truck. This falls under the Workers Compensation primary case type. The fact that the injury was caused by an automobile accident makes the secondary case type Automobile Accident. The injury is described as L4 L5 damage, which requires surgery, putting it in Tier 4. The incident happened in Philadelphia, PA, so the case state is PA Pennsylvania. The description also specifies that the client was working at the time, so this is a Workers Compensation case. The confidence level is high due to the clear description of the incident and the identification of the state.\n\nThe case rating is Tier 3 and case types are Workers Compensation and Automobile Accident, which fall under the 'Any' category. Therefore, according to the handling rules for the state, the recommended handling firm is 'REFER TO PA SECTION'.", "HandlingFirm": "REFER TO PA SECTION"}
{"CaseDescription": "Kevin Johnson DOI 9/28/2023 Swift Transportation Phila PA Injury back damage CL was working driving an 18 wheeler and was hit and injured by another commercial truck. CL injured his back and had back surgery that was diagnosed as L4 L5 damage. CL lost time form work and loss of income. Still seeing doctors and taking pain meds. Damages CL uses cane and suffers from limited mobility", "PrimaryCaseType": "Workers Compensation", "SecondaryCaseType": "Automobile Accident", "CaseRating": "Tier 3", "CaseState": "PA Pennsylvania", "IsWorkersCompensation": "Yes", "Confidence(%)": "90%", "Explanation": "The description indicates that the client was driving an 18 wheeler for work when he was hit and injured by another commercial truck. This falls under the Workers Compensation primary case type. The fact that the injury was caused by an automobile accident makes the secondary case type Automobile Accident. The injury is described as L4 L5 damage, which requires surgery, putting it in Tier 4. The incident happened in Philadelphia, PA, so the case state is PA Pennsylvania. The description also specifies that the client was working at the time, so this is a Workers Compensation case. The confidence level is high due to the clear description of the incident and the identification of the state.\n\nThe case rating is Tier 3 and case types are Workers Compensation and Automobile Accident, which fall under the 'Any' category. Therefore, according to the handling rules for the state, the recommended handling firm is 'REFER TO PA SECTION'.", "HandlingFirm": "REFER TO PA SECTION"}
{"CaseDescription": "Kevin Johnson DOI 9/28/2023 Swift Transportation Phila PA Injury back damage CL was working driving an 18 wheeler and was hit and injured by another commercial truck. CL injured his back and had back surgery that was diagnosed as L4 L5 damage. CL lost time form work and loss of income. Still seeing doctors and taking pain meds. Damages CL uses cane and suffers from limited mobility", "PrimaryCaseType": "Workers Compensation", "SecondaryCaseType": "Automobile Accident", "CaseRating": "Tier 3", "CaseState": "PA Pennsylvania", "IsWorkersCompensation": "Yes", "Confidence(%)": "90%", "Explanation": "The description indicates that the client was driving an 18 wheeler for work when he was hit and injured by another commercial truck. This falls under the Workers Compensation primary case type. The fact that the injury was caused by an automobile accident makes the secondary case type Automobile Accident. The injury is described as L4 L5 damage, which requires surgery, putting it in Tier 4. The incident happened in Philadelphia, PA, so the case state is PA Pennsylvania. The description also specifies that the client was working at the time, so this is a Workers Compensation case. The confidence level is high due to the clear description of the incident and the identification of the state.\n\nThe case rating is Tier 3 and case types are Workers Compensation and Automobile Accident, which fall under the 'Any' category. Therefore, according to the handling rules for the state, the recommended handling firm is 'REFER TO PA SECTION'.", "HandlingFirm": "REFER TO PA SECTION", "CaseId": "2b64a078-a54e-430d-a226-a05f21448723"}
{"CaseDescription": "Kevin Johnson DOI 9/28/2023 Swift Transportation Phila PA Injury back damage CL was working driving an 18 wheeler and was hit and injured by another commercial truck. CL injured his back and had back surgery that was diagnosed as L4 L5 damage. CL lost time form work and loss of income. Still seeing doctors and taking pain meds. Damages CL uses cane and suffers from limited mobility", "PrimaryCaseType": "Workers Compensation", "SecondaryCaseType": "Automobile Accident", "CaseRating": "Tier 3", "CaseState": "PA Pennsylvania", "IsWorkersCompensation": "Yes", "Confidence(%)": "90%", "Explanation": "The description indicates that the client was driving an 18 wheeler for work when he was hit and injured by another commercial truck. This falls under the Workers Compensation primary case type. The fact that the injury was caused by an automobile accident makes the secondary case type Automobile Accident. The injury is described as L4 L5 damage, which requires surgery, putting it in Tier 4. The incident happened in Philadelphia, PA, so the case state is PA Pennsylvania. The description also specifies that the client was working at the time, so this is a Workers Compensation case. The confidence level is high due to the clear description of the incident and the identification of the state.\n\nThe case rating is Tier 3 and case types are Workers Compensation and Automobile Accident, which fall under the 'Any' category. Therefore, according to the handling rules for the state, the recommended handling firm is 'REFER TO PA SECTION'.", "HandlingFirm": "REFER TO PA SECTION", "CaseId": "2b64a078-a54e-430d-a226-a05f21448723"}
{"CaseDescription": "Kevin Johnson DOI 9/28/2023 Swift Transportation Phila PA Injury back damage CL was working driving an 18 wheeler and was hit and injured by another commercial truck. CL injured his back and had back surgery that was diagnosed as L4 L5 damage. CL lost time form work and loss of income. Still seeing doctors and taking pain meds. Damages CL uses cane and suffers from limited mobility", "PrimaryCaseType": "Workers Compensation", "SecondaryCaseType": "Automobile Accident", "CaseRating": "Tier 3", "CaseState": "PA Pennsylvania", "IsWorkersCompensation": "Yes", "Confidence(%)": "90%", "Explanation": "The description indicates that the client was driving an 18 wheeler for work when he was hit and injured by another commercial truck. This falls under the Workers Compensation primary case type. The fact that the injury was caused by an automobile accident makes the secondary case type Automobile Accident. The injury is described as L4 L5 damage, which requires surgery, putting it in Tier 4. The incident happened in Philadelphia, PA, so the case state is PA Pennsylvania. The description also specifies that the client was working at the time, so this is a Workers Compensation case. The confidence level is high due to the clear description of the incident and the identification of the state.\n\nThe case rating is Tier 3 and case types are Workers Compensation and Automobile Accident, which fall under the 'Any' category. Therefore, according to the handling rules for the state, the recommended handling firm is 'REFER TO PA SECTION'.", "HandlingFirm": "REFER TO PA SECTION", "CaseId": "2b64a078-a54e-430d-a226-a05f21448723"}
{"CaseDescription": "Kevin Johnson DOI 9/28/2023 Swift Transportation Phila PA Injury back damage CL was working driving an 18 wheeler and was hit and injured by another commercial truck. CL injured his back and had back surgery that was diagnosed as L4 L5 damage. CL lost time form work and loss of income. Still seeing doctors and taking pain meds. Damages CL uses cane and suffers from limited mobility", "PrimaryCaseType": "Workers Compensation", "SecondaryCaseType": "Automobile Accident", "CaseRating": "Tier 3", "CaseState": "PA Pennsylvania", "IsWorkersCompensation": "Yes", "Confidence(%)": "90%", "Explanation": "The description indicates that the client was driving an 18 wheeler for work when he was hit and injured by another commercial truck. This falls under the Workers Compensation primary case type. The fact that the injury was caused by an automobile accident makes the secondary case type Automobile Accident. The injury is described as L4 L5 damage, which requires surgery, putting it in Tier 4. The incident happened in Philadelphia, PA, so the case state is PA Pennsylvania. The description also specifies that the client was working at the time, so this is a Workers Compensation case. The confidence level is high due to the clear description of the incident and the identification of the state.\n\nThe case rating is Tier 3 and case types are Workers Compensation and Automobile Accident, which fall under the 'Any' category. Therefore, according to the handling rules for the state, the recommended handling firm is 'REFER TO PA SECTION'.", "HandlingFirm": "REFER TO PA SECTION", "CaseId": "2b64a078-a54e-430d-a226-a05f21448723"}
{"msg": "PC employed through Labor Ready as a cook. She was sent to a job site on 8/15/23. While working, she tripped over a hazardous 2x4 causing injury. Incident reported. Seen at hospital ER then sent to Concentra but no tests were done. She was rushed into PT but was in severe pain. She went back to ER and testing found knee is sprained w/ tear of MCL, also breaks in her foot. Currently treating and OOW. Just set up f/u with ortho. She would be eager to speak with your office regarding assistance in her workers' compensation claim in New York (NY)."}
{"msg": " In Nevada, an assistant manager at an Arby's injured her right knee while putting up a truck. After reporting the incident, she was sent for medical care and placed on light duty. Following physical therapy, she's now on a leave of absence. Two weeks off work, she awaits approval for an MRI and nerve test, seeking legal assistance for a work comp claim."}
{"msg": "  In Florida, an assistant manager at an Arby's injured her right knee while putting up a truck. Following the incident report, she was sent for medical care and put on light duty. After completing physical therapy, she's recently been placed on a leave of absence. With two weeks off work, she awaits approval for an MRI and nerve test, seeking legal assistance for a work comp claim."}
{"msg": "Ohio witnessed an assistant manager at an Arby's injure her right knee while putting up a truck. Promptly reporting the incident, she was sent for medical care and put on light duty. After completing physical therapy, she's now on a leave of absence. Two weeks off work, she awaits approval for an MRI and nerve test, seeking legal aid for a work comp claim."}
{"msg": "Ohio witnessed an assistant manager at an Arby's injure her right knee while putting up a truck."}
{"msg": " In Texas, an assistant manager at an Arby's injured her right knee while putting up a truck. After reporting the incident, she was sent for medical care and placed on light duty. Following physical therapy, she's recently been placed on a leave of absence. With two weeks off work, she awaits approval for an MRI and nerve test, seeking legal assistance for a work comp claim."}
{"msg": " Arizona saw an assistant manager at an Arby's injure her right knee while putting up a truck. Following the incident report, she was sent for medical care and put on light duty. After completing physical therapy, she's now on a leave of absence. Two weeks off work, she awaits approval for an MRI and nerve test, seeking legal aid for a work comp claim."}
{"msg": "  In New York, an assistant manager at an Arby's injured her right knee while putting up a truck. Promptly reporting the incident, she was sent for medical care and placed on light duty. After completing physical therapy, she's recently been placed on a leave of absence. With two weeks off work, she awaits approval for an MRI and nerve test, seeking legal assistance for a work comp claim."}
{"msg": " Oregon witnessed an assistant manager at an Arby's injure her right knee while putting up a truck. After reporting the incident, she was sent for medical care and put on light duty. Following physical therapy, she's now on a leave of absence. Two weeks off work, she awaits approval for an MRI and nerve test, seeking legal aid for a work comp claim."}
{"msg": "  In Louisiana, an assistant manager at an Arby's injured her right knee while putting up a truck. Following the incident report, she was sent for medical care and put on light duty. After completing physical therapy, she's recently been placed on a leave of absence. With two weeks off work, she awaits approval for an MRI and nerve test, seeking legal assistance for a work comp claim."}
{"msg": " Colorado saw an assistant manager at an Arby's injure her right knee while putting up a truck. Promptly reporting the incident, she was sent for medical care and placed on light duty. After completing physical therapy, she's now on a leave of absence. Two weeks off work, she awaits approval for an MRI and nerve test, seeking legal aid for a work comp claim"}
{"msg": "  In Virginia, an assistant manager at an Arby's injured her right knee while putting up a truck. After reporting the incident, she was sent for medical care and put on light duty. Following physical therapy, she was recently placed on a leave of absence. Off work for two weeks now, she awaits approval for an MRI and nerve test, seeking legal assistance for a work comp claim."}
{"msg": " North Carolina witnessed a homecare rep through Bayada Nurses Home Care injuring her right thumb while repositioning a patient. After reporting the incident, she was sent to urgent care the next day, where an x-ray revealed a fractured thumb. Now restricted in her working hours, she seeks legal assistance for a work comp claim, with treatment at Lugiano Medical Care mandated."}
